web-scraper-order,web-scraper-start-url,items,items-href,title,autoren,erscheinungsjahr,journal/konferenz
"1647209846-1741","https://www.alexandria.unisg.ch/view/pub_alex_user_id/624.html?","Wearable Business Solutions – Herleitung und Auswirkung auf die Value Creation durch Unternehmen im Jahr 2021 mittels Szenariotechnik und Delphimethode.","https://www.alexandria.unisg.ch/249220/","Wearable Business Solutions – Herleitung und Auswirkung auf die Value Creation durch Unternehmen im Jahr 2021 mittels Szenariotechnik und Delphimethode","Heusler, Noemi & Back, Andrea","August 2016","null"
"1647210279-1957","https://www.alexandria.unisg.ch/view/pub_alex_user_id/624.html?","Coworking aus Unternehmenssicht – Out of Office, into the Flow?","https://www.alexandria.unisg.ch/258568/","Coworking aus Unternehmenssicht – Out of Office, into the Flow?","Josef, Barbara & Back, Andrea","12 July 2019","Arbeiten 4.0"
"1647210110-1873","https://www.alexandria.unisg.ch/view/pub_alex_user_id/624.html?","Prozesskostenrechnung.","https://www.alexandria.unisg.ch/66706/","Prozesskostenrechnung","Back, Andrea","1 Januar 1994","Bilanzbuchhalter"
"1647209701-1669","https://www.alexandria.unisg.ch/view/pub_alex_user_id/624.html?","Assessing Degrees of Web-2.0-ness: Model and Results for Product Websites in the Pharma-Industry.","https://www.alexandria.unisg.ch/214345/","Assessing Degrees of Web-2.0-ness: Model and Results for Product Websites in the Pharma-Industry","Back, Andrea & Haager, Christoph","14 Juni 2011","null"
"1647209634-1636","https://www.alexandria.unisg.ch/view/pub_alex_user_id/624.html?","Open Educational Resources in der Web-2.0 Bewegung: Facetten der Freiheit, zu Lehr-/Lernmaterialien beizutragen und diese zu nutzen.","https://www.alexandria.unisg.ch/214073/","Open Educational Resources in der Web-2.0 Bewegung: Facetten der Freiheit, zu Lehr-/Lernmaterialien beizutragen und diese zu nutzen","Back, Andrea","15 November 2007","null"
"1647209818-1727","https://www.alexandria.unisg.ch/view/pub_alex_user_id/624.html?","Workplace E-Collaboration: Theoretical Foundations and Practical Implications.","https://www.alexandria.unisg.ch/213166/","Workplace E-Collaboration: Theoretical Foundations and Practical Implications","Mayrhofer, David & Back, Andrea","1 April 2003","null"
"1647209842-1739","https://www.alexandria.unisg.ch/view/pub_alex_user_id/624.html?","Data Mining and Social Network Analysis of Ideation Contests : A Repeated Measures Design.","https://www.alexandria.unisg.ch/226769/","Data Mining and Social Network Analysis of Ideation Contests : A Repeated Measures Design","Walter, Thomas & Back, Andrea","2013","null"
"1647209492-1565","https://www.alexandria.unisg.ch/view/pub_alex_user_id/624.html?","High-Tech Teaching in a Semi-Virtual CEMS Course: Experiences with Collaborative Learning in Action.","https://www.alexandria.unisg.ch/213854/","High-Tech Teaching in a Semi-Virtual CEMS Course: Experiences with Collaborative Learning in Action","Back, Andrea","18 Mai 2000","null"
"1647209830-1733","https://www.alexandria.unisg.ch/view/pub_alex_user_id/624.html?","Beiträge der Balanced Scorecard für ein nachhaltiges E-Learning im Unternehmen.","https://www.alexandria.unisg.ch/213942/","Beiträge der Balanced Scorecard für ein nachhaltiges E-Learning im Unternehmen","Leithner, Barbara & Back, Andrea","1 April 2004","null"
"1647209510-1574","https://www.alexandria.unisg.ch/view/pub_alex_user_id/624.html?","eLearning als Herausforderung für die Personal- und Organisationsentwicklung.","https://www.alexandria.unisg.ch/214097/","eLearning als Herausforderung für die Personal- und Organisationsentwicklung","Back, Andrea","17 July 2001","null"
"1647209698-1667","https://www.alexandria.unisg.ch/view/pub_alex_user_id/624.html?","Von einer, die auszog, in der Cloud zu arbeiten: Ein Erfahrungsbericht ….","https://www.alexandria.unisg.ch/213964/","Von einer, die auszog, in der Cloud zu arbeiten: Ein Erfahrungsbericht …","Back, Andrea","9 Juni 2011","null"
"1647209725-1681","https://www.alexandria.unisg.ch/view/pub_alex_user_id/624.html?","Habilitation: ""Beiträge der Daten-, Informations- und Wissensverarbeitung zur Weiterentwicklung des Internen Rechnungswesens und Controllings"".","https://www.alexandria.unisg.ch/196668/","Habilitation: ""Beiträge der Daten-, Informations- und Wissensverarbeitung zur Weiterentwicklung des Internen Rechnungswesens und Controllings"".","Back, Andrea","1 Januar 1993","null"
"1647210245-1940","https://www.alexandria.unisg.ch/view/pub_alex_user_id/624.html?","Mediennutzung in der Projektkommunikation von Studierenden - Analyse dreier Praxisprojekte unter besonderer Berücksichtigung der Kollaborationsplattform MavenLink.","https://www.alexandria.unisg.ch/238596/","Mediennutzung in der Projektkommunikation von Studierenden - Analyse dreier Praxisprojekte unter besonderer Berücksichtigung der Kollaborationsplattform MavenLink","Rennhard, Yannick & Back, Andrea","30 September 2014","Interdisziplinäre Zeitschrift für Technologie und Lernen : iTeL"
"1647209930-1783","https://www.alexandria.unisg.ch/view/pub_alex_user_id/624.html?","E-Learning im Unternehmen.","https://www.alexandria.unisg.ch/67460/","E-Learning im Unternehmen","Back, Andrea","2008","null"
"1647210231-1933","https://www.alexandria.unisg.ch/view/pub_alex_user_id/624.html?","Implementing a Classification Scheme for Enterprise 2.0.","https://www.alexandria.unisg.ch/217412/","Implementing a Classification Scheme for Enterprise 2.0","Back, Andrea & Irmler, Peter","1 Oktober 2012","Information Technology : it"
"1647209562-1600","https://www.alexandria.unisg.ch/view/pub_alex_user_id/624.html?","Der rechte Umgang mit Stakeholdern.","https://www.alexandria.unisg.ch/66833/","Der rechte Umgang mit Stakeholdern","Back, Andrea","8 Oktober 2003","null"
"1647209804-1720","https://www.alexandria.unisg.ch/view/pub_alex_user_id/624.html?","Neue Lerntechnologien (NLT) in Schweizerischen Industrieunternehmen.","https://www.alexandria.unisg.ch/213511/","Neue Lerntechnologien (NLT) in Schweizerischen Industrieunternehmen","Back, Andrea & Bursian, Olaf","1 August 2001","null"
"1647210014-1825","https://www.alexandria.unisg.ch/view/pub_alex_user_id/624.html?","Success Factor Validation for Global ERP Programmes.","https://www.alexandria.unisg.ch/213715/","Success Factor Validation for Global ERP Programmes","Seidel, Gunter & Back, Andrea","8 Juni 2009","null"
"1647210056-1846","https://www.alexandria.unisg.ch/view/pub_alex_user_id/624.html?","Success and Failure: Two Longitudinal Case Studies on Media-Tablet Usage in CRM.","https://www.alexandria.unisg.ch/225216/","Success and Failure: Two Longitudinal Case Studies on Media-Tablet Usage in CRM","Sammer, Thomas; Vögeli, Sandro & Back, Andrea","12 Juni 2013","null"
"1647210062-1849","https://www.alexandria.unisg.ch/view/pub_alex_user_id/624.html?","Efficient And Ubiquitous Resource Allocation - Can Smartphones Improve Urban Traffic Flow Associated With Numerous Cars Searching For Parking Spaces?","https://www.alexandria.unisg.ch/226174/","Efficient And Ubiquitous Resource Allocation - Can Smartphones Improve Urban Traffic Flow Associated With Numerous Cars Searching For Parking Spaces?","Fiechter, Daniel; Sammer, Thomas & Back, Andrea","2 Oktober 2013","null"
"1647209472-1555","https://www.alexandria.unisg.ch/view/pub_alex_user_id/624.html?","Groupware im Kontext problemorientierter Computing Workspaces.","https://www.alexandria.unisg.ch/66861/","Groupware im Kontext problemorientierter Computing Workspaces","Back, Andrea","11 Januar 1999","null"
"1647209816-1726","https://www.alexandria.unisg.ch/view/pub_alex_user_id/624.html?","Potenziale pädagogischer Agenten.","https://www.alexandria.unisg.ch/213194/","Potenziale pädagogischer Agenten","Bendel, Oliver; Schnoering, Katharina & Back, Andrea","15 Januar 2002","null"
"1647209783-1709","https://www.alexandria.unisg.ch/view/pub_alex_user_id/624.html?","Competing with Intellectual Capital: Theoretical Background.","https://www.alexandria.unisg.ch/196948/","Competing with Intellectual Capital: Theoretical Background","Back, Andrea; Seufert, Andreas; Vassiliadis, Stefanos & von Krogh, Georg","20 März 2000","null"
"1647209798-1717","https://www.alexandria.unisg.ch/view/pub_alex_user_id/624.html?","Betreibermodell und Anreizsystem für Multimedia-gestützte Studiengänge im Weiterbildungsmarkt.","https://www.alexandria.unisg.ch/196924/","Betreibermodell und Anreizsystem für Multimedia-gestützte Studiengänge im Weiterbildungsmarkt","Leithner, Barbara; Keller, Miriam; Bursian, Olaf; Bendel, Oliver & Back, Andrea","14 März 2001","null"
"1647209454-1546","https://www.alexandria.unisg.ch/view/pub_alex_user_id/624.html?","The Knowledge Creation Company: Strategisches Management & IKT.","https://www.alexandria.unisg.ch/213560/","The Knowledge Creation Company: Strategisches Management & IKT","Back, Andrea & Seufert, Andreas","16 April 1998","null"
"1647210158-1897","https://www.alexandria.unisg.ch/view/pub_alex_user_id/624.html?","Computeranalphabet trotz PC-Führerschein?","https://www.alexandria.unisg.ch/197094/","Computeranalphabet trotz PC-Führerschein?","Back, Andrea","30 September 1998","IBM uptodate"
"1647210012-1824","https://www.alexandria.unisg.ch/view/pub_alex_user_id/624.html?","Learning Journal - Weblogs in Academic Courses.","https://www.alexandria.unisg.ch/213205/","Learning Journal - Weblogs in Academic Courses","Hain, Stefanie & Back, Andrea","26 Juni 2008","null"
"1647209765-1701","https://www.alexandria.unisg.ch/view/pub_alex_user_id/624.html?","The Influence of Human Networks and Human Value Systems on Knowledge Sharing/Transfer Projects.","https://www.alexandria.unisg.ch/66704/","The Influence of Human Networks and Human Value Systems on Knowledge Sharing/Transfer Projects","Koehne, Marija; Raimann, Joerg; Seufert, Andreas; von Krogh, G. & Back, Andrea","1 Januar 1999","null"
"1647210205-1920","https://www.alexandria.unisg.ch/view/pub_alex_user_id/624.html?","A Reference Model for E-Collaboration within the Dispersed Sales Force Training Process in Multinational Companies.","https://www.alexandria.unisg.ch/213624/","A Reference Model for E-Collaboration within the Dispersed Sales Force Training Process in Multinational Companies","Heidecke, Florian & Back, Andrea","1 Januar 2009","International Journal of e-Collaboration"
"1647209536-1587","https://www.alexandria.unisg.ch/view/pub_alex_user_id/624.html?","Zum Verhältnis von eLearning und Wissensmanagement in Unternehmen.","https://www.alexandria.unisg.ch/213831/","Zum Verhältnis von eLearning und Wissensmanagement in Unternehmen","Back, Andrea","1 Oktober 2002","null"
"1647209792-1714","https://www.alexandria.unisg.ch/view/pub_alex_user_id/624.html?","Perspective for our partners: Innovation, Knowledge creation, Customer Integration and Launching new Ventures.","https://www.alexandria.unisg.ch/296/","Perspective for our partners: Innovation, Knowledge creation, Customer Integration and Launching new Ventures","Enkel, Ellen; Gibbert, Michael; Makarevitch, Alexei & Vassiliadis, Stefanos","2001","null"
"1647210132-1884","https://www.alexandria.unisg.ch/view/pub_alex_user_id/624.html?","Groupwarebasierter Help-Desk für Informatikprobleme: eine Applikation unter Lotus Notes an der Universität St. Gallen.","https://www.alexandria.unisg.ch/196928/","Groupwarebasierter Help-Desk für Informatikprobleme: eine Applikation unter Lotus Notes an der Universität St. Gallen","Back, Andrea & Schubert, P.","1 Januar 1996","HMD: Praxis der Wirtschaftsinformatik"
"1647209844-1740","https://www.alexandria.unisg.ch/view/pub_alex_user_id/624.html?","Critical Factors Influencing Innovation Diffusion on Corporate Websites.","https://www.alexandria.unisg.ch/231448/","Critical Factors Influencing Innovation Diffusion on Corporate Websites","Zollet, Roman & Back, Andrea","2014","null"
"1647210179-1907","https://www.alexandria.unisg.ch/view/pub_alex_user_id/624.html?","Workplace Learning: mit E-Learning im Arbeitsprozess lernen.","https://www.alexandria.unisg.ch/213665/","Workplace Learning: mit E-Learning im Arbeitsprozess lernen","Back, Andrea","1 Januar 2003","SKO-Leader"
"1647209751-1694","https://www.alexandria.unisg.ch/view/pub_alex_user_id/624.html?","Rollen, Prozesse und Führung in der Digitalen Transformation: Ratgeber und Fallstudien zur Strategiearbeit für das digitale Zeitalter (Teil 2).","https://www.alexandria.unisg.ch/248725/","Rollen, Prozesse und Führung in der Digitalen Transformation: Ratgeber und Fallstudien zur Strategiearbeit für das digitale Zeitalter (Teil 2)","Berghaus, Sabine & Back, Andrea","2016","null"
"1647209704-1671","https://www.alexandria.unisg.ch/view/pub_alex_user_id/624.html?","Ich bin drin - im Web 2.0! Meine Arbeitspraxis 2.0.","https://www.alexandria.unisg.ch/216764/","Ich bin drin - im Web 2.0! Meine Arbeitspraxis 2.0.","Back, Andrea","2 Dezember 2011","null"
"1647209540-1589","https://www.alexandria.unisg.ch/view/pub_alex_user_id/624.html?","Wissensmanagement IKT-Systeme und -Tools.","https://www.alexandria.unisg.ch/213562/","Wissensmanagement IKT-Systeme und -Tools","Back, Andrea","1 Oktober 2002","null"
"1647209936-1786","https://www.alexandria.unisg.ch/view/pub_alex_user_id/624.html?","A Reference Model for E-Collaboration within the Dispersed Sales Force Training Process in Multinational Companies.","https://www.alexandria.unisg.ch/214092/","A Reference Model for E-Collaboration within the Dispersed Sales Force Training Process in Multinational Companies","Heidecke, Florian & Back, Andrea","2009","null"
"1647209658-1648","https://www.alexandria.unisg.ch/view/pub_alex_user_id/624.html?","Revolutionäre Trends in der Zusammenarbeit: The wiki way, the twitter way, the open innovation way.","https://www.alexandria.unisg.ch/213366/","Revolutionäre Trends in der Zusammenarbeit: The wiki way, the twitter way, the open innovation way","Back, Andrea","23 September 2009","null"
"1647209912-1774","https://www.alexandria.unisg.ch/view/pub_alex_user_id/624.html?","Organisation des Aussendiensttrainings in der Pharma-Branche: Entwicklung eines Referenzmodells mittels Fallstudienforschung.","https://www.alexandria.unisg.ch/213547/","Organisation des Aussendiensttrainings in der Pharma-Branche: Entwicklung eines Referenzmodells mittels Fallstudienforschung","Das Training von Außendienstmitarbeitern im Vertrieb stellt hinsichtlich seiner Organisation eine große Herausforderung dar. Weiterhin hat Training in der pharmazeutischen Industrie einen größeren Einfluss auf die Performance von Vertriebsmitarbeitern als in anderen Branchen. Die Autoren stellen im Rahmen dieser Forschungsarbeit ein Referenzmodell für das Außendiensttraining in dezentral organisierten, global operierenden Unternehmen der Pharmabranche vor. Dieses wurde im Rahmen eines Design-Science-Ansatzes mittels vergleichender Fallstudienforschung entwickelt. Untersucht wurden dabei die strategische Verankerung, die Aufbau- und Ablauforganisation sowie die Unterstützung einzelner Aufgaben des Außendiensttrainings durch Informations- und Kommunikationstechnologie an acht weltweit verteilten Standorten. Darauf aufbauend wurde anschließend das Referenzmodell entworfen, welches auch für die Praxis konkrete Gestaltungsempfehlungen liefert.","2007","null"
"1647209598-1618","https://www.alexandria.unisg.ch/view/pub_alex_user_id/624.html?","Lernen am Puls der Zeit gestalten.","https://www.alexandria.unisg.ch/213149/","Lernen am Puls der Zeit gestalten","Back, Andrea","1 November 2005","null"
"1647210116-1876","https://www.alexandria.unisg.ch/view/pub_alex_user_id/624.html?","Kanzleiinformationssystem.","https://www.alexandria.unisg.ch/213561/","Kanzleiinformationssystem","Back, Andrea & Seufert, Andreas","1 Januar 1995","Datenverarbeitung-Steuer-Wirtschaft-Recht"
"1647209622-1630","https://www.alexandria.unisg.ch/view/pub_alex_user_id/624.html?","Wissensnetzwerke in Unternehmen - mit Technik und Pragmatismus zum Erfolg.","https://www.alexandria.unisg.ch/213527/","Wissensnetzwerke in Unternehmen - mit Technik und Pragmatismus zum Erfolg","Back, Andrea","15 Februar 2007","null"
"1647209880-1758","https://www.alexandria.unisg.ch/view/pub_alex_user_id/624.html?","Wissensnetzwerke: Das neue Instrument für die Förderung von Wissensaustausch und Wissensentwicklung im Unternehmen.","https://www.alexandria.unisg.ch/264/","Wissensnetzwerke: Das neue Instrument für die Förderung von Wissensaustausch und Wissensentwicklung im Unternehmen","Enkel, Ellen & Back, Andrea","2002","null"
"1647209892-1764","https://www.alexandria.unisg.ch/view/pub_alex_user_id/624.html?","Elektronische Märkte.","https://www.alexandria.unisg.ch/9114/","Elektronische Märkte","Der Begriff des Elektronischen Marktes ist in der Fachliteratur bereits etabliert. In den letzten Jahren sind dazu verschiedene Arbeiten veröffentlicht worden, z.B. [MaYaBe87], [MaYaBe89], [Bako91b], [Freu91]. Ein einheitlicher Sprachgebrauch liegt jedoch noch nicht vor. Folgende Begriffe werden mit ""Elektronischem Markt"" (Electronic Market) im wesentlichen synonym verwendet: Elektronischer Marktplatz (Electronic Marketplace, z.B. [Bako91b]), Elektronische Beschaffung (Electronic Purchasing [Hubm89], [Butl90]), Computerisierter oder seltener: Automatisierter Handel (Computrized / Automated Trading [Domo90], [Domo92]) bez. Elektronischer Handel (Electronic Trading / Trade, z.B. [Freu89], [Kuul90]). Gewisse Formen Elektronischer Märkte werden auch mit Electronic Marketing bezeichnet (vgl. [Butl90]), was insofern unglücklich ist, als dieser Begriff schon in der eigentlichen Marketingliteratur verwendet wird, [HeSc92]. Im Gegenzug verwenden einige Autoren für Systeme der Datenerhebung am Verkaufspunkt ebenfalls den Begriff Elektronischer Marktplatz [Cord91]. Der Sprachgebrauch ist uneinheitlich. Es ist deshalb angezeigt, sich zunächst klarzumachen, welche Funktionen Märkte in unserem arbeitsteiligen Produktionssystem haben.","2004","null"
"1647209560-1599","https://www.alexandria.unisg.ch/view/pub_alex_user_id/624.html?","Insights from taking a business engineering perspective on corporate eLearning.","https://www.alexandria.unisg.ch/66864/","Insights from taking a business engineering perspective on corporate eLearning","Back, Andrea","1 Oktober 2003","null"
"1647209496-1567","https://www.alexandria.unisg.ch/view/pub_alex_user_id/624.html?","Wissensmanagement und IT-Technologie - eine häufig missverstandene Beziehung.","https://www.alexandria.unisg.ch/213261/","Wissensmanagement und IT-Technologie - eine häufig missverstandene Beziehung","Back, Andrea","6 July 2000","null"
"1647210086-1861","https://www.alexandria.unisg.ch/view/pub_alex_user_id/624.html?","Deterrent Effects of Warnings on User’s Behavior in Preventing Malicious
Software Use.","https://www.alexandria.unisg.ch/250195/","Deterrent Effects of Warnings on User’s Behavior in Preventing Malicious
Software Use","Silic, Mario & Back, Andrea","6 Januar 2017","null"
"1647209904-1770","https://www.alexandria.unisg.ch/view/pub_alex_user_id/624.html?","A methodology for adapting Knowledge Networks - managerial guidelines.","https://www.alexandria.unisg.ch/256/","A methodology for adapting Knowledge Networks - managerial guidelines","Enkel, Ellen; Gurgul, Grzegorz & Rumyantseva, Maria","2007","null"
"1647210259-1947","https://www.alexandria.unisg.ch/view/pub_alex_user_id/624.html?","Factors driving unified communications and collaboration adoption and use in organizations.","https://www.alexandria.unisg.ch/247618/","Factors driving unified communications and collaboration adoption and use in organizations","Silic, Mario & Back, Andrea","23 Februar 2016","Measuring Business Excellence"
"1647209866-1751","https://www.alexandria.unisg.ch/view/pub_alex_user_id/624.html?","Lernen im Cyberspace: Die Zukunft der Wissensentwicklung und Bildungsdienstleistung?","https://www.alexandria.unisg.ch/213482/","Lernen im Cyberspace: Die Zukunft der Wissensentwicklung und Bildungsdienstleistung?","Back, Andrea","2000","null"
"1647210114-1875","https://www.alexandria.unisg.ch/view/pub_alex_user_id/624.html?","Aspekte zur Implementierung und Nutzung einer Prozesskostenrechnung. Rubrik Meinungsspiegel.","https://www.alexandria.unisg.ch/213946/","Aspekte zur Implementierung und Nutzung einer Prozesskostenrechnung. Rubrik Meinungsspiegel","Back, Andrea","1 Januar 1994","Kostenrechnungspraxis-Sonderheft"
"1647209840-1738","https://www.alexandria.unisg.ch/view/pub_alex_user_id/624.html?","Construction of a Method for Assessing the Likelihood of Burnout of Global ERP Programmes.","https://www.alexandria.unisg.ch/213580/","Construction of a Method for Assessing the Likelihood of Burnout of Global ERP Programmes","Seidel, Gunter & Back, Andrea","1 März 2010","null"
"1647209759-1698","https://www.alexandria.unisg.ch/view/pub_alex_user_id/624.html?","Evaluation Report: Review of the Knowledge Management Activities in the Unilever Culinary Category.","https://www.alexandria.unisg.ch/196967/","Evaluation Report: Review of the Knowledge Management Activities in the Unilever Culinary Category","Back, Andrea & von Krogh, G.","1 August 1998","null"
"1647210052-1844","https://www.alexandria.unisg.ch/view/pub_alex_user_id/624.html?","Organizational Culture Impact on Acceptance and Use of Unified Communications & Collaboration Technology in Organizations.","https://www.alexandria.unisg.ch/223688/","Organizational Culture Impact on Acceptance and Use of Unified Communications & Collaboration Technology in Organizations","Silic, Mario & Back, Andrea","9 Juni 2013","null"
"1647209918-1777","https://www.alexandria.unisg.ch/view/pub_alex_user_id/624.html?","E-Learning strategisch verankern.","https://www.alexandria.unisg.ch/66658/","E-Learning strategisch verankern","Back, Andrea","2007","null"
"1647209763-1700","https://www.alexandria.unisg.ch/view/pub_alex_user_id/624.html?","Knowledge Networks: Linking Knowledge Management to Business Strategy.","https://www.alexandria.unisg.ch/214149/","Knowledge Networks: Linking Knowledge Management to Business Strategy","Vassiliadis, Stefanos; Wicki, Yvonne; Seufert, Andreas; von Krogh, G. & Back, Andrea","1 Januar 1999","null"
"1647210225-1930","https://www.alexandria.unisg.ch/view/pub_alex_user_id/624.html?","Broadening Participation in Knowledge Management in Enterprise 2.0.","https://www.alexandria.unisg.ch/146672/","Broadening Participation in Knowledge Management in Enterprise 2.0","Back, Andrea & Koch, Michael","1 Mai 2011","Information Technology : it"
"1647209767-1702","https://www.alexandria.unisg.ch/view/pub_alex_user_id/624.html?","Dealing with Knowledge Assets.","https://www.alexandria.unisg.ch/66690/","Dealing with Knowledge Assets","Vassiliadis, Stefanos; Gysin, Karl; Seufert, Andreas; Back, Andrea & von Krogh, G.","1 Januar 1999","null"
"1647210213-1924","https://www.alexandria.unisg.ch/view/pub_alex_user_id/624.html?","Die Öffnung des Innovationsprozesses.","https://www.alexandria.unisg.ch/214353/","Die Öffnung des Innovationsprozesses","Back, Andrea","1 November 2009","wirtschaftsmagazin"
"1647209826-1731","https://www.alexandria.unisg.ch/view/pub_alex_user_id/624.html?","Web-Conferencing Software Tools: A Comprehensive Market Survey.","https://www.alexandria.unisg.ch/214335/","Web-Conferencing Software Tools: A Comprehensive Market Survey","Mayrhofer, David; Back, Andrea & Hubschmid, Roger","1 April 2004","null"
"1647209854-1745","https://www.alexandria.unisg.ch/view/pub_alex_user_id/624.html?","Implementierung und Nutzung der Prozesskostenrechnung.","https://www.alexandria.unisg.ch/214286/","Implementierung und Nutzung der Prozesskostenrechnung","Back, Andrea","1995","null"
"1647210263-1949","https://www.alexandria.unisg.ch/view/pub_alex_user_id/624.html?","The dark side of social networking sites : Understanding phishing risks.","https://www.alexandria.unisg.ch/247617/","The dark side of social networking sites : Understanding phishing risks","Silic, Mario & Back, Andrea","1 July 2016","Computers in Human Behavior"
"1647209729-1683","https://www.alexandria.unisg.ch/view/pub_alex_user_id/624.html?","Lean & agil: Social-Software.","https://www.alexandria.unisg.ch/231833/","Lean & agil: Social-Software","Back, Andrea","20 Mai 2014","Computerworld.ch"
"1647210185-1910","https://www.alexandria.unisg.ch/view/pub_alex_user_id/624.html?","E-Meetings in Europa: State-of-the-art und Zukunftstrends.","https://www.alexandria.unisg.ch/213218/","E-Meetings in Europa: State-of-the-art und Zukunftstrends","Mayrhofer, David & Back, Andrea","1 Juni 2003","Bulletin"
"1647209683-1660","https://www.alexandria.unisg.ch/view/pub_alex_user_id/624.html?","Enterprise 2.0-Fallstudien - Aus Erfahrung lernen.","https://www.alexandria.unisg.ch/214409/","Enterprise 2.0-Fallstudien - Aus Erfahrung lernen","Back, Andrea & Koch, Michael","16 September 2010","null"
"1647209670-1654","https://www.alexandria.unisg.ch/view/pub_alex_user_id/624.html?","Silo-Breaking through Open (e-)Cooperation - Zusammenarbeit von Hochschullehre und Unternehmenspraxis.","https://www.alexandria.unisg.ch/197456/","Silo-Breaking through Open (e-)Cooperation - Zusammenarbeit von Hochschullehre und Unternehmenspraxis","Back, Andrea","11 März 2010","null"
"1647209942-1789","https://www.alexandria.unisg.ch/view/pub_alex_user_id/624.html?","Projektmanagement bei verteilten Teams mit Jive-Gruppen im Swiss Re Ourspace.","https://www.alexandria.unisg.ch/216607/","Projektmanagement bei verteilten Teams mit Jive-Gruppen im Swiss Re Ourspace","Back, Andrea; Fuellemann, Peter & Jastrowski, Wolfgang","2012","null"
