web-scraper-order,web-scraper-start-url,items,items-href,title,autoren,erscheinungsjahr,journal/konferenz
"1647209906-1771","https://www.alexandria.unisg.ch/view/pub_alex_user_id/624.html?","The customer - an untapped source of innovations. Developing a Customer Integration Network in HP.","https://www.alexandria.unisg.ch/257/","The customer - an untapped source of innovations. Developing a Customer Integration Network in HP","Gurgul, Grzegorz; Enkel, Ellen; Rumyantseva, Maria & Ulrich, Claudia","2007","null"
"1647210289-1962","https://www.alexandria.unisg.ch/view/pub_alex_user_id/624.html?","How an Incumbent Telecoms Operator Became an IoT Ecosystem Orchestrator.","https://www.alexandria.unisg.ch/264517/","How an Incumbent Telecoms Operator Became an IoT Ecosystem Orchestrator","Marheine, Christian; Engel, Christian & Back, Andrea","2021","MIS Quarterly Executive"
"1647209976-1806","https://www.alexandria.unisg.ch/view/pub_alex_user_id/624.html?","Business Engineering - Die ersten 15 Jahre.","https://www.alexandria.unisg.ch/213582/","Business Engineering - Die ersten 15 Jahre","null","2004","null"
"1647209884-1760","https://www.alexandria.unisg.ch/view/pub_alex_user_id/624.html?","Entscheidungsunterstützungssysteme.","https://www.alexandria.unisg.ch/213558/","Entscheidungsunterstützungssysteme","Back, Andrea","2002","null"
"1647209570-1604","https://www.alexandria.unisg.ch/view/pub_alex_user_id/624.html?","Lerneffektivität im Licht der Geschäftsziele: HR-Balanced Scorecard.","https://www.alexandria.unisg.ch/66873/","Lerneffektivität im Licht der Geschäftsziele: HR-Balanced Scorecard","Back, Andrea","11 Februar 2004","null"
"1647210074-1855","https://www.alexandria.unisg.ch/view/pub_alex_user_id/624.html?","Is an App Better than an Email? Developing Trust in a Mobile Financial Advisory Service : Design and Evaluation of a Prototype.","https://www.alexandria.unisg.ch/239780/","Is an App Better than an Email? Developing Trust in a Mobile Financial Advisory Service : Design and Evaluation of a Prototype","Ruf, Christian; Back, Andrea & Wittmann, Matthias","5 März 2015","null"
"1647209558-1598","https://www.alexandria.unisg.ch/view/pub_alex_user_id/624.html?","Strategische Ausrichtung von E-Learning.","https://www.alexandria.unisg.ch/213861/","Strategische Ausrichtung von E-Learning","Back, Andrea","1 Oktober 2003","null"
"1647209898-1767","https://www.alexandria.unisg.ch/view/pub_alex_user_id/624.html?","Balanced Learning Scorecard: Den Wert von (E-)Learning-Innovationen für Geschäftsziele kommunizieren.","https://www.alexandria.unisg.ch/213936/","Balanced Learning Scorecard: Den Wert von (E-)Learning-Innovationen für Geschäftsziele kommunizieren","Back, Andrea","2005","null"
"1647210138-1887","https://www.alexandria.unisg.ch/view/pub_alex_user_id/624.html?","Der Cyberspace des 21. Jahrhunderts - Unsere virtuelle neue Welt?","https://www.alexandria.unisg.ch/196991/","Der Cyberspace des 21. Jahrhunderts - Unsere virtuelle neue Welt?","Back, Andrea","1 Januar 1997","Forum FN: Themen der Zeit"
"1647209564-1601","https://www.alexandria.unisg.ch/view/pub_alex_user_id/624.html?","Die Rolle des CLO.","https://www.alexandria.unisg.ch/213651/","Die Rolle des CLO","Back, Andrea","26 November 2003","null"
"1647209460-1549","https://www.alexandria.unisg.ch/view/pub_alex_user_id/624.html?","Wirtschaftlichkeitsanalysen im IV-Bereich.","https://www.alexandria.unisg.ch/66896/","Wirtschaftlichkeitsanalysen im IV-Bereich","Back, Andrea","2 Juni 1998","null"
"1647210044-1840","https://www.alexandria.unisg.ch/view/pub_alex_user_id/624.html?","Determination of Enterprise 2.0 Development Levels with a Maturity Model.","https://www.alexandria.unisg.ch/215829/","Determination of Enterprise 2.0 Development Levels with a Maturity Model","Friedel, Dominik & Back, Andrea","17 July 2012","null"
"1647209681-1659","https://www.alexandria.unisg.ch/view/pub_alex_user_id/624.html?","Reifegrad-Modell und Methode zur Beurteilung des Vorbereitungsgrads von Organisationen für die Einführung von Kollaboration 2.0.","https://www.alexandria.unisg.ch/221827/","Reifegrad-Modell und Methode zur Beurteilung des Vorbereitungsgrads von Organisationen für die Einführung von Kollaboration 2.0","Back, Andrea","15 September 2010","null"
"1647210233-1934","https://www.alexandria.unisg.ch/view/pub_alex_user_id/624.html?","Factors impacting information governance in the mobile device dual-use context.","https://www.alexandria.unisg.ch/225291/","Factors impacting information governance in the mobile device dual-use context","Silic, Mario & Back, Andrea","29 August 2013","Records Management Journal"
"1647209594-1616","https://www.alexandria.unisg.ch/view/pub_alex_user_id/624.html?","Return on E-Learning Investment.","https://www.alexandria.unisg.ch/66882/","Return on E-Learning Investment","Back, Andrea","4 März 2005","null"
"1647209646-1642","https://www.alexandria.unisg.ch/view/pub_alex_user_id/624.html?","Web-based Open Innovation - ""What‘s Your Strategy for Creating Knowledge, Products, and Services with Online Communities?"".","https://www.alexandria.unisg.ch/213661/","Web-based Open Innovation - ""What‘s Your Strategy for Creating Knowledge, Products, and Services with Online Communities?""","Back, Andrea","19 März 2009","null"
"1647209852-1744","https://www.alexandria.unisg.ch/view/pub_alex_user_id/624.html?","Coworking aus Unternehmenssicht II: Out of Office – into the Flow?","https://www.alexandria.unisg.ch/256520/","Coworking aus Unternehmenssicht II: Out of Office – into the Flow?","Josef, Barbara; Sapegina, Anastasia; Back, Andrea & Weibel, Antoinette","Januar 2019","null"
"1647210112-1874","https://www.alexandria.unisg.ch/view/pub_alex_user_id/624.html?","Ein Modell zur Kalkulation der Kosten je Absolvent.","https://www.alexandria.unisg.ch/196672/","Ein Modell zur Kalkulation der Kosten je Absolvent","Back, Andrea","1 Januar 1994","ZfB-Sonderheft"
"1647210235-1935","https://www.alexandria.unisg.ch/view/pub_alex_user_id/624.html?","Systemic Differences between SaaS- and On-Premise-ERP : An Overview of a Qualitative Option Calculation Scheme.","https://www.alexandria.unisg.ch/226179/","Systemic Differences between SaaS- and On-Premise-ERP : An Overview of a Qualitative Option Calculation Scheme","Link, Björn & Back, Andrea","1 Oktober 2013","AIS Transactions on Enterprise Systems"
"1647210281-1958","https://www.alexandria.unisg.ch/view/pub_alex_user_id/624.html?","Innovation durch den Einsatz von Enterprise
IoT-Lösungen: Ein Modell zur Bestimmung des
Innovationspotenzials.","https://www.alexandria.unisg.ch/258266/","Innovation durch den Einsatz von Enterprise
IoT-Lösungen: Ein Modell zur Bestimmung des
Innovationspotenzials","Marheine, Christian; Gruber, Lukas & Back, Andrea","4 November 2019","HMD Praxis der Wirtschaftsinformatik"
"1647210050-1843","https://www.alexandria.unisg.ch/view/pub_alex_user_id/624.html?","A Text Mining Approach to Evaluate Submissions to Crowdsourcing Contests.","https://www.alexandria.unisg.ch/223363/","A Text Mining Approach to Evaluate Submissions to Crowdsourcing Contests","Walter, Thomas & Back, Andrea","7 Januar 2013","null"
"1647210046-1841","https://www.alexandria.unisg.ch/view/pub_alex_user_id/624.html?","Narrative Hypervideos: Methodenentwurf zur Nutzung usergenerierter Videos in der Wissenskommunikation.","https://www.alexandria.unisg.ch/218402/","Narrative Hypervideos: Methodenentwurf zur Nutzung usergenerierter Videos in der Wissenskommunikation","Back, Andrea & Toedtli, Maria Camilla","10 September 2012","null"
"1647209775-1706","https://www.alexandria.unisg.ch/view/pub_alex_user_id/624.html?","Dialogplattform Knowledge Management der Deutschen Bank AG (Internal Paper).","https://www.alexandria.unisg.ch/214060/","Dialogplattform Knowledge Management der Deutschen Bank AG (Internal Paper)","Bendel, Oliver; Stoller-Schai, Daniel; Mergel, Ines & Back, Andrea","10 März 2000","null"
"1647210181-1908","https://www.alexandria.unisg.ch/view/pub_alex_user_id/624.html?","Wissensinitiativen: Überall, aber wo genau?","https://www.alexandria.unisg.ch/65861/","Wissensinitiativen: Überall, aber wo genau?","Ammann Schoch, Regina; Back, Andrea; Kunert, Karsten & Tresch, Markus","1 Januar 2003","io new management"
"1647209618-1628","https://www.alexandria.unisg.ch/view/pub_alex_user_id/624.html?","eCollaboration Goes Web 2.0 - Von den Basistechnologien zu den Trends effektiver verteilter Zusammenarbeit.","https://www.alexandria.unisg.ch/214022/","eCollaboration Goes Web 2.0 - Von den Basistechnologien zu den Trends effektiver verteilter Zusammenarbeit","Back, Andrea","1 Februar 2007","null"
"1647209990-1813","https://www.alexandria.unisg.ch/view/pub_alex_user_id/624.html?","Web 2.0 und Social Media in der Unternehmenspraxis : Grundlagen, Anwendungen und Methoden mit zahlreichen Fallstudien.","https://www.alexandria.unisg.ch/216026/","Web 2.0 und Social Media in der Unternehmenspraxis : Grundlagen, Anwendungen und Methoden mit zahlreichen Fallstudien","Wertvolle Anregungen zur gewinnbringenden Nutzung von Web-2.0-Anwendungen und Social Media in Unternehmen und Verwaltung.Wikis, Blogs, Community-Plattformen und Social Media sind heute selbstverständlich in der Geschäftspraxis. Typische Einsatzfelder sind interne Kollaboration, Wissens- und Innovationsmanagement, Marketing und Recruiting. Wie kann Social Software ihre Aufgaben beeinflussen und ihre Prozesse verbessern? Über 60 führende Autorinnen und Autoren aus Wissenschaft und Praxis geben darauf in diesem Buch eine Antwort.Das Buch schafft Klarheit über Web-2.0-Prinzipien und den Zusammenhang relevanter Fachbegriffe. Die detaillierte Beschreibung der Anwendungsklassen und Konzepte - wie z. B. Soziale Netzwerke, Blogs, Wikis, Microblogging, Crowdsourcing oder Social Forecasting - macht die vielseitigen Nutzungsmöglichkeiten von Social Business Software verständlich. Auch jüngste Entwicklungen im mobilen Web 2.0 und die zunehmend stärker integrierten Anwendungen im Enterprise 2.0 werden behandelt.Hinzu kommen 20 ausführlich beschriebene Fallstudien, die einen Querschnitt über die verschiedenen Geschäftsprozesse in zahlreichen Branchen abdecken und zeigen, was in der Praxis Nutzen bringt und welche Erfolgsfaktoren ausschlaggebend sind. Lösungen von namhaften Grossunternehmen sind ebenso vertreten wie Lösungen von KMU und Anwendungen im öffentlichen Sektor. Die in der 3. Auflage neu hinzugekommenen Kapitel zu Rahmenbedingungen und Methoden liefern Projektverantwortlichen konkrete Managementinstrumente, um Social-Software-Projekte ganzheitlich und kompetent angehen zu können.Vorschau im [http://www.oldenbourg-verlag.de/wissenschaftsverlag/web-20-und-social-media-unternehmenspraxis/9783486598322 Oldenbourg Verlag]","2012","null"
"1647210018-1827","https://www.alexandria.unisg.ch/view/pub_alex_user_id/624.html?","Open (e-)Cooperation - Ein Erfahrungsbericht zu Formen der Zusammenarbeit von Hochschullehre und Unternehmenspraxis.","https://www.alexandria.unisg.ch/68008/","Open (e-)Cooperation - Ein Erfahrungsbericht zu Formen der Zusammenarbeit von Hochschullehre und Unternehmenspraxis","Back, Andrea","11 März 2010","null"
"1647209616-1627","https://www.alexandria.unisg.ch/view/pub_alex_user_id/624.html?","Unterwegs auf der Formel 1-Rennstrecke der e-Learning-Innovationen.","https://www.alexandria.unisg.ch/67057/","Unterwegs auf der Formel 1-Rennstrecke der e-Learning-Innovationen","Back, Andrea","4 Dezember 2006","null"
"1647210030-1833","https://www.alexandria.unisg.ch/view/pub_alex_user_id/624.html?","Assessing Degrees of Web-2.0-ness: Model and Results for Product Websites in the Pharma-Industry.","https://www.alexandria.unisg.ch/232358/","Assessing Degrees of Web-2.0-ness: Model and Results for Product Websites in the Pharma-Industry","Back, Andrea & Haager, Christopher","12 Juni 2011","null"
"1647209461-1550","https://www.alexandria.unisg.ch/view/pub_alex_user_id/624.html?","Potentiale der neuen Medien in der Ausbildung: 7 Thesen.","https://www.alexandria.unisg.ch/214310/","Potentiale der neuen Medien in der Ausbildung: 7 Thesen","Back, Andrea","20 August 1998","null"
"1647209886-1761","https://www.alexandria.unisg.ch/view/pub_alex_user_id/624.html?","E-Learning und Wissensmanagement zusammenführen.","https://www.alexandria.unisg.ch/214323/","E-Learning und Wissensmanagement zusammenführen","Back, Andrea","2002","null"
"1647209982-1809","https://www.alexandria.unisg.ch/view/pub_alex_user_id/624.html?","Knowledge Networks for Business Growth.","https://www.alexandria.unisg.ch/300/","Knowledge Networks for Business Growth","null","2006","null"
"1647210169-1902","https://www.alexandria.unisg.ch/view/pub_alex_user_id/624.html?","Computer Supported Cooperative Work (CSCW) - State-of-the-Art und zukünftige Herausforderungen.","https://www.alexandria.unisg.ch/213276/","Computer Supported Cooperative Work (CSCW) - State-of-the-Art und zukünftige Herausforderungen","Back, Andrea & Seufert, Andreas","1 Juni 2000","HMD - Praxis der Wirtschaftsinformatik"
"1647209745-1691","https://www.alexandria.unisg.ch/view/pub_alex_user_id/624.html?","Employing Consumer IT in Operations: Will iPads Save Money, Increase Efficiency, and Raise User Satisfaction?","https://www.alexandria.unisg.ch/230900/","Employing Consumer IT in Operations: Will iPads Save Money, Increase Efficiency, and Raise User Satisfaction?","Sammer, Thomas; Back, Andrea & Brechbühl, Hans","2014","null"
"1647209636-1637","https://www.alexandria.unisg.ch/view/pub_alex_user_id/624.html?","Lernkurve von 1.x nach 2.x - Erkenntnisse nach 100 Tagen Wissensblog.","https://www.alexandria.unisg.ch/213950/","Lernkurve von 1.x nach 2.x - Erkenntnisse nach 100 Tagen Wissensblog","Back, Andrea","10 April 2008","null"
"1647209672-1655","https://www.alexandria.unisg.ch/view/pub_alex_user_id/624.html?","Web-Video zur Wissenskommunikation.","https://www.alexandria.unisg.ch/68834/","Web-Video zur Wissenskommunikation","Back, Andrea","13 April 2010","null"
"1647209676-1657","https://www.alexandria.unisg.ch/view/pub_alex_user_id/624.html?","2.0 Upgradings in Project Management - Opportunities and Risks Through Wiki-Way- and (Micro)Blogging Practices.","https://www.alexandria.unisg.ch/213944/","2.0 Upgradings in Project Management - Opportunities and Risks Through Wiki-Way- and (Micro)Blogging Practices","Back, Andrea","21 Juni 2010","null"
"1647209834-1735","https://www.alexandria.unisg.ch/view/pub_alex_user_id/624.html?","Ich habe fertig - aus der Sicht der Mertens-Zauberlehrlinge (Laudatio, gehalten an der WISO in Nürnberg am 10. Januar 2006, Emeritierung Prof. Dr. Peter Mertens).","https://www.alexandria.unisg.ch/213849/","Ich habe fertig - aus der Sicht der Mertens-Zauberlehrlinge (Laudatio, gehalten an der WISO in Nürnberg am 10. Januar 2006, Emeritierung Prof. Dr. Peter Mertens)","Back, Andrea","1 Januar 2006","null"
"1647209773-1705","https://www.alexandria.unisg.ch/view/pub_alex_user_id/624.html?","Knowledge Networks - A Tools Perspective.","https://www.alexandria.unisg.ch/197477/","Knowledge Networks - A Tools Perspective","Raimann, Joerg; Koehne, Marija; Seufert, Andreas; Back, Andrea & von Krogh, G.","1 Januar 2000","null"
"1647209902-1769","https://www.alexandria.unisg.ch/view/pub_alex_user_id/624.html?","Developmental aspects and supportive factors in Knowledge Networks.","https://www.alexandria.unisg.ch/262/","Developmental aspects and supportive factors in Knowledge Networks","Köhne, M.; Enkel, Ellen & Ulrich, C.","2006","null"
"1647209743-1690","https://www.alexandria.unisg.ch/view/pub_alex_user_id/624.html?","Mobile Business 2013 : Der Einfluss von Second Generation Enterprise Mobility auf die Value Chain von Unternehmen.","https://www.alexandria.unisg.ch/232126/","Mobile Business 2013 : Der Einfluss von Second Generation Enterprise Mobility auf die Value Chain von Unternehmen","Sammer, Thomas; Back, Andrea & Bessing, Stefan","2013","null"
"1647209910-1773","https://www.alexandria.unisg.ch/view/pub_alex_user_id/624.html?","Supporting Growth through Innovation Networks in Unilever.","https://www.alexandria.unisg.ch/260/","Supporting Growth through Innovation Networks in Unilever","Rumyantseva, Maria; Enkel, Ellen & Pos, A.","2007","null"
"1647210257-1946","https://www.alexandria.unisg.ch/view/pub_alex_user_id/624.html?","The Influence of Risk Factors in Decision-Making Process for Open Source Software Adoption.","https://www.alexandria.unisg.ch/246832/","The Influence of Risk Factors in Decision-Making Process for Open Source Software Adoption","Silic, Mario & Back, Andrea","Januar 2016","International Journal of Information Technology and Decision Making"
"1647209890-1763","https://www.alexandria.unisg.ch/view/pub_alex_user_id/624.html?","Vom Kursprojekt zum Reengineering der Bildungsprozesse.","https://www.alexandria.unisg.ch/213737/","Vom Kursprojekt zum Reengineering der Bildungsprozesse","Back, Andrea","2004","null"
"1647210020-1828","https://www.alexandria.unisg.ch/view/pub_alex_user_id/624.html?","Website Usability for Internet Banking.","https://www.alexandria.unisg.ch/214619/","Website Usability for Internet Banking","Zollet, Roman & Back, Andrea","20 Juni 2010","null"
"1647209477-1558","https://www.alexandria.unisg.ch/view/pub_alex_user_id/624.html?","Kooperatives Lernen im Internet.","https://www.alexandria.unisg.ch/213414/","Kooperatives Lernen im Internet","Back, Andrea","1 September 1999","null"
"1647209522-1580","https://www.alexandria.unisg.ch/view/pub_alex_user_id/624.html?","Basis-Workshop Wissensmanagement (WM).","https://www.alexandria.unisg.ch/66825/","Basis-Workshop Wissensmanagement (WM)","Back, Andrea","5 Oktober 2001","null"
"1647209824-1730","https://www.alexandria.unisg.ch/view/pub_alex_user_id/624.html?","Web-Conferencing Software Tools: Evaluierung der Marktführer.","https://www.alexandria.unisg.ch/67644/","Web-Conferencing Software Tools: Evaluierung der Marktführer","Mayrhofer, David; Back, Andrea & Hubschmid, Roger","1 April 2004","null"
"1647209788-1712","https://www.alexandria.unisg.ch/view/pub_alex_user_id/624.html?","Training for Knowledge Networks: Documentation.","https://www.alexandria.unisg.ch/214311/","Training for Knowledge Networks: Documentation","Vassiliadis, Stefanos; Raimann, Joerg; Seufert, Andreas; Back, Andrea & von Krogh, G.","1 Oktober 2000","null"
"1647210156-1896","https://www.alexandria.unisg.ch/view/pub_alex_user_id/624.html?","2005: Virtuelle Universitäten auf dem Vormarsch.","https://www.alexandria.unisg.ch/196947/","2005: Virtuelle Universitäten auf dem Vormarsch","Schuh, G.; Back, Andrea; Friedli, T. & Seufert, Sabine","1 Januar 1998","Thexis-Sonderheft Management Szenarien 2005"
"1647209836-1736","https://www.alexandria.unisg.ch/view/pub_alex_user_id/624.html?","Newsaggregatoren-Software - ein Marktüberblick.","https://www.alexandria.unisg.ch/213814/","Newsaggregatoren-Software - ein Marktüberblick","Heidecke, Florian & Back, Andrea","1 April 2007","null"
"1647209530-1584","https://www.alexandria.unisg.ch/view/pub_alex_user_id/624.html?","Podiumsdiskussion ""Deutschland - Entwicklerstandort oder Entwicklungsland?"", geleitet von Dr. H.-H. Kappel; weitere Mitwirkende Prof. Dr. H.-L. Grob, Prof. Dr. M. Zitterbart, F. Milius, Armin Hopp.","https://www.alexandria.unisg.ch/213629/","Podiumsdiskussion ""Deutschland - Entwicklerstandort oder Entwicklungsland?"", geleitet von Dr. H.-H. Kappel; weitere Mitwirkende Prof. Dr. H.-L. Grob, Prof. Dr. M. Zitterbart, F. Milius, Armin Hopp.","Back, Andrea","7 Februar 2002","null"
"1647210088-1862","https://www.alexandria.unisg.ch/view/pub_alex_user_id/624.html?","Impact of Gamification on User’s Knowledge-Sharing Practices:Relationships between Work Motivation, Performance Expectancy and Work Engagement.","https://www.alexandria.unisg.ch/250228/","Impact of Gamification on User’s Knowledge-Sharing Practices:Relationships between Work Motivation, Performance Expectancy and Work Engagement","Silic, Mario & Back, Andrea","7 Januar 2017","null"
"1647210040-1838","https://www.alexandria.unisg.ch/view/pub_alex_user_id/624.html?","Einsatzmöglichkeiten von Virtual Private Workspace.","https://www.alexandria.unisg.ch/216768/","Einsatzmöglichkeiten von Virtual Private Workspace","Schoenenberg, Robin & Back, Andrea","21 Februar 2012","null"
"1647209966-1801","https://www.alexandria.unisg.ch/view/pub_alex_user_id/624.html?","Collaboration Between Corporations and Startups: The Startup-Collaboration-Model.","https://www.alexandria.unisg.ch/258561/","Collaboration Between Corporations and Startups: The Startup-Collaboration-Model","Peter, Lukas; Back, Andrea & Werro, Tina","2019","null"
"1647209591-1614","https://www.alexandria.unisg.ch/view/pub_alex_user_id/624.html?","Einführung.","https://www.alexandria.unisg.ch/213501/","Einführung","Back, Andrea","18 November 2004","null"
"1647209984-1810","https://www.alexandria.unisg.ch/view/pub_alex_user_id/624.html?","Getting real about knowledge networks : unlocking corporate knowledge assets.","https://www.alexandria.unisg.ch/213997/","Getting real about knowledge networks : unlocking corporate knowledge assets","null","2006","null"
"1647209820-1728","https://www.alexandria.unisg.ch/view/pub_alex_user_id/624.html?","Lernen im Medienverbund: Nachhaltigkeit von Aus- und Weiterbildung der Polizei BaWü.","https://www.alexandria.unisg.ch/213461/","Lernen im Medienverbund: Nachhaltigkeit von Aus- und Weiterbildung der Polizei BaWü","Bendel, Oliver; Leithner, Barbara; Keller, Miriam & Back, Andrea","1 April 2003","null"
"1647209574-1606","https://www.alexandria.unisg.ch/view/pub_alex_user_id/624.html?","E-Learning Balanced Scorecard.","https://www.alexandria.unisg.ch/66841/","E-Learning Balanced Scorecard","Back, Andrea","23 März 2004","null"
"1647209470-1554","https://www.alexandria.unisg.ch/view/pub_alex_user_id/624.html?","Einführung und Leitung 1. Block 2. Woche: ""Applikationen"", Groupware und Knowledge Management.","https://www.alexandria.unisg.ch/66853/","Einführung und Leitung 1. Block 2. Woche: ""Applikationen"", Groupware und Knowledge Management","Back, Andrea","5 Januar 1999","null"
"1647209553-1595","https://www.alexandria.unisg.ch/view/pub_alex_user_id/624.html?","E-Learning strategisch verankern.","https://www.alexandria.unisg.ch/66847/","E-Learning strategisch verankern","Back, Andrea","4 September 2003","null"
"1647210080-1858","https://www.alexandria.unisg.ch/view/pub_alex_user_id/624.html?","Atos - Towards Zero Email Company.","https://www.alexandria.unisg.ch/242235/","Atos - Towards Zero Email Company","Silic, Mario; Back, Andrea & Silic, Dario","28 Mai 2015","null"
"1647209520-1579","https://www.alexandria.unisg.ch/view/pub_alex_user_id/624.html?","e-Welt: Wissensmanagement.","https://www.alexandria.unisg.ch/66851/","e-Welt: Wissensmanagement","Back, Andrea","3 Oktober 2001","null"
"1647209674-1656","https://www.alexandria.unisg.ch/view/pub_alex_user_id/624.html?","Welche Kompetenzen in der digitalen Welt 2020 gebraucht werden.","https://www.alexandria.unisg.ch/213699/","Welche Kompetenzen in der digitalen Welt 2020 gebraucht werden","Back, Andrea","16 Juni 2010","null"
"1647209938-1787","https://www.alexandria.unisg.ch/view/pub_alex_user_id/624.html?","Wissens-Wiki im IT-Betrieb und Notfall-Management bei der SFS services AG.","https://www.alexandria.unisg.ch/216601/","Wissens-Wiki im IT-Betrieb und Notfall-Management bei der SFS services AG","Cervellieri, Adrian; Buchli, Reto & Back, Andrea","2012","null"
"1647210171-1903","https://www.alexandria.unisg.ch/view/pub_alex_user_id/624.html?","Software-Tools und Architekturmodell für das Wissensmanagement.","https://www.alexandria.unisg.ch/197020/","Software-Tools und Architekturmodell für das Wissensmanagement","Raimann, Joerg & Back, Andrea","1 July 2000","ControllerNews: Die Zeitschrift für Controlling und Unternehmensführung"
"1647209566-1602","https://www.alexandria.unisg.ch/view/pub_alex_user_id/624.html?","Erfolgreiche E-Learning-Anwendungsfelder - jetzt und in der Zukunft.","https://www.alexandria.unisg.ch/66859/","Erfolgreiche E-Learning-Anwendungsfelder - jetzt und in der Zukunft","Back, Andrea","2 Dezember 2003","null"
"1647209934-1785","https://www.alexandria.unisg.ch/view/pub_alex_user_id/624.html?","Web-DNA-Analyse von (((rebell.tv))) - Publizieren und Kommunizieren in innovativer Genese.","https://www.alexandria.unisg.ch/213959/","Web-DNA-Analyse von (((rebell.tv))) - Publizieren und Kommunizieren in innovativer Genese","Back, Andrea","2009","null"
"1647210038-1837","https://www.alexandria.unisg.ch/view/pub_alex_user_id/624.html?","Wie weit und bereit sind Unternehmen mit Enterprise 2.0 - Ergebnisse einer Reifegradstudie im deutschsprachigen Raum.","https://www.alexandria.unisg.ch/214383/","Wie weit und bereit sind Unternehmen mit Enterprise 2.0 - Ergebnisse einer Reifegradstudie im deutschsprachigen Raum","Friedel, Dominik; Back, Andrea & Wieland, Ralf","28 September 2011","null"
"1647210277-1956","https://www.alexandria.unisg.ch/view/pub_alex_user_id/624.html?","Conceptual framework for collaborative open innovation with a startup ecosystem.","https://www.alexandria.unisg.ch/258570/","Conceptual framework for collaborative open innovation with a startup ecosystem","Peter, Lukas; Back, Andrea & Werro, Tina","2019","Innovation in the Digital Economy"
"1647209703-1670","https://www.alexandria.unisg.ch/view/pub_alex_user_id/624.html?","Towards a Framework for Business Model Design of Scientific Journals with Web 2.0 Principles.","https://www.alexandria.unisg.ch/214408/","Towards a Framework for Business Model Design of Scientific Journals with Web 2.0 Principles","Back, Andrea","4 September 2011","null"
