web-scraper-order,web-scraper-start-url,items,items-href,title,autoren,erscheinungsjahr,journal/konferenz
"1647210082-1859","https://www.alexandria.unisg.ch/view/pub_alex_user_id/624.html?","Designing Tablet Banking Apps for High-Net-Worth Individuals : Specifying Customer Requirements with Prototyping.","https://www.alexandria.unisg.ch/241640/","Designing Tablet Banking Apps for High-Net-Worth Individuals : Specifying Customer Requirements with Prototyping","Ruf, Christian; Back, Andrea & Weidenfeld, Henk Andreas","3 Juni 2015","null"
"1647210022-1829","https://www.alexandria.unisg.ch/view/pub_alex_user_id/624.html?","Crowdsourcing as a Business Model: An exploration of emergent textbooks harnessing the wisdom of crowds.","https://www.alexandria.unisg.ch/69069/","Crowdsourcing as a Business Model: An exploration of emergent textbooks harnessing the wisdom of crowds","Walter, Thomas & Back, Andrea","23 Juni 2010","null"
"1647209838-1737","https://www.alexandria.unisg.ch/view/pub_alex_user_id/624.html?","State-of-the-Art on Maturity Models for Collaboration.","https://www.alexandria.unisg.ch/214253/","State-of-the-Art on Maturity Models for Collaboration","Hain, Stefanie & Back, Andrea","1 Oktober 2009","null"
"1647209998-1817","https://www.alexandria.unisg.ch/view/pub_alex_user_id/624.html?","Chief-Learning-Officer-Projektagenda 200x.","https://www.alexandria.unisg.ch/213774/","Chief-Learning-Officer-Projektagenda 200x","Back, Andrea","30 September 2002","null"
"1647210092-1864","https://www.alexandria.unisg.ch/view/pub_alex_user_id/624.html?","Disentangling the Fuzzy Front End of Digital Transformation: Activities and Approaches.","https://www.alexandria.unisg.ch/254097/","Disentangling the Fuzzy Front End of Digital Transformation: Activities and Approaches","Berghaus, Sabine & Back, Andrea","10 Dezember 2017","null"
"1647210148-1892","https://www.alexandria.unisg.ch/view/pub_alex_user_id/624.html?","Szenario Bildungslandschaft 2005.","https://www.alexandria.unisg.ch/213742/","Szenario Bildungslandschaft 2005","Back, Andrea","1 Januar 1998","Informatik/Informatique"
"1647209778-1707","https://www.alexandria.unisg.ch/view/pub_alex_user_id/624.html?","Supporting Business Processes through Knowledge Management - A Technology-based Analysis.","https://www.alexandria.unisg.ch/214245/","Supporting Business Processes through Knowledge Management - A Technology-based Analysis","Raimann, Joerg; Enkel, Ellen; Seufert, Andreas; Back, Andrea & von Krogh, G.","17 März 2000","null"
"1647209870-1753","https://www.alexandria.unisg.ch/view/pub_alex_user_id/624.html?","Massenspeicher, magnetischer.","https://www.alexandria.unisg.ch/196940/","Massenspeicher, magnetischer","Müller, Jochen","2001","null"
"1647210251-1943","https://www.alexandria.unisg.ch/view/pub_alex_user_id/624.html?","Classifying systemic differences between Software as a Service- and On-Premise-Enterprise Resource Planning.","https://www.alexandria.unisg.ch/244524/","Classifying systemic differences between Software as a Service- and On-Premise-Enterprise Resource Planning","Link, Björn & Back, Andrea","13 Oktober 2015","Journal of Enterprise Information Management"
"1647209850-1743","https://www.alexandria.unisg.ch/view/pub_alex_user_id/624.html?","Agile Innovation for Next Generation Mobile Business.","https://www.alexandria.unisg.ch/255092/","Agile Innovation for Next Generation Mobile Business","Guggisberg, Vanessa & Back, Andrea","Dezember 2017","null"
"1647209695-1666","https://www.alexandria.unisg.ch/view/pub_alex_user_id/624.html?","Enterprise 2.0 für das Management.","https://www.alexandria.unisg.ch/146663/","Enterprise 2.0 für das Management","Back, Andrea","23 Mai 2011","null"
"1647209868-1752","https://www.alexandria.unisg.ch/view/pub_alex_user_id/624.html?","Virtual Reality.","https://www.alexandria.unisg.ch/66700/","Virtual Reality","Back, Andrea","2001","null"
"1647210247-1941","https://www.alexandria.unisg.ch/view/pub_alex_user_id/624.html?","Balancing Innovation and Operations: Opportunities and Challenges of Second Generation Enterprise Mobility.","https://www.alexandria.unisg.ch/235813/","Balancing Innovation and Operations: Opportunities and Challenges of Second Generation Enterprise Mobility","Berghaus, Sabine; Sammer, Thomas; Brechbühl, Hans & Back, Andrea","14 Oktober 2014","The journal of management systems"
"1647209932-1784","https://www.alexandria.unisg.ch/view/pub_alex_user_id/624.html?","Web-based Open Innovation - Wie Online-Gemeinschaften Dienstleistungen, Produkte und Wissen mitgestalten.","https://www.alexandria.unisg.ch/67823/","Web-based Open Innovation - Wie Online-Gemeinschaften Dienstleistungen, Produkte und Wissen mitgestalten","Back, Andrea","2009","null"
"1647209958-1797","https://www.alexandria.unisg.ch/view/pub_alex_user_id/624.html?","Mobile Business.","https://www.alexandria.unisg.ch/246909/","Mobile Business","Back, Andrea & Ruf, Christian","2016","null"
"1647209718-1678","https://www.alexandria.unisg.ch/view/pub_alex_user_id/624.html?","Social Media: What is Social Media and how will Social Media change our future working environment.","https://www.alexandria.unisg.ch/216812/","Social Media: What is Social Media and how will Social Media change our future working environment","Back, Andrea","20 August 2012","null"
"1647209542-1590","https://www.alexandria.unisg.ch/view/pub_alex_user_id/624.html?","Skill-Management: Heutiger Erkenntnisstand.","https://www.alexandria.unisg.ch/213314/","Skill-Management: Heutiger Erkenntnisstand","Back, Andrea","1 Oktober 2002","null"
"1647210048-1842","https://www.alexandria.unisg.ch/view/pub_alex_user_id/624.html?","Das St. Galler Enterprise 2.0 Methodenset - Ein Ansatz zum organisatorischen Wandel.","https://www.alexandria.unisg.ch/218408/","Das St. Galler Enterprise 2.0 Methodenset - Ein Ansatz zum organisatorischen Wandel","Friedel, Dominik & Back, Andrea","24 Oktober 2012","null"
"1647210227-1931","https://www.alexandria.unisg.ch/view/pub_alex_user_id/624.html?","Nutzerpräferenzen für Funktionen mobiler Lernanwendungen in der betrieblichen Bildung.","https://www.alexandria.unisg.ch/219811/","Nutzerpräferenzen für Funktionen mobiler Lernanwendungen in der betrieblichen Bildung","Back, Andrea & Henestrosa, Alexandra","2012","Zeitschrift für E-Learning : Lernkultur und Bildungstechnologie"
"1647210189-1912","https://www.alexandria.unisg.ch/view/pub_alex_user_id/624.html?","Wissensmanagement strategisch verankern.","https://www.alexandria.unisg.ch/65939/","Wissensmanagement strategisch verankern","Ammann Schoch, Regina; Back, Andrea; Kunert, Karsten & Tresch, Markus","1 April 2004","Wissensmanagement : das Magazin für Führungskräfte"
"1647210106-1871","https://www.alexandria.unisg.ch/view/pub_alex_user_id/624.html?","Vorarbeiten für die Datenmodellierung am Beispiel zweier Industrieunternehmen : Automatisierte Dateninventur und elektronischer Begriffskatalog.","https://www.alexandria.unisg.ch/213572/","Vorarbeiten für die Datenmodellierung am Beispiel zweier Industrieunternehmen : Automatisierte Dateninventur und elektronischer Begriffskatalog","Back, Andrea","1 Januar 1994","Wirtschaftsinformatik 36"
"1647209790-1713","https://www.alexandria.unisg.ch/view/pub_alex_user_id/624.html?","Perspective for our partners: New Ventures: important concepts and theories.","https://www.alexandria.unisg.ch/294/","Perspective for our partners: New Ventures: important concepts and theories","Makarevitch, Alexei & Enkel, Ellen","2001","null"
"1647209691-1664","https://www.alexandria.unisg.ch/view/pub_alex_user_id/624.html?","Videobasiertes Workplace Learning - Auf dem Siegeszug 2.0.","https://www.alexandria.unisg.ch/102534/","Videobasiertes Workplace Learning - Auf dem Siegeszug 2.0","Back, Andrea","6 April 2011","null"
"1647210066-1851","https://www.alexandria.unisg.ch/view/pub_alex_user_id/624.html?","Design Requirements for Collaboration Processes to Increase Customer Trust in Mobile Banking Platforms.","https://www.alexandria.unisg.ch/232054/","Design Requirements for Collaboration Processes to Increase Customer Trust in Mobile Banking Platforms","Ruf, Christian & Back, Andrea","1 Juni 2014","null"
"1647209476-1557","https://www.alexandria.unisg.ch/view/pub_alex_user_id/624.html?","Szenario Bildungslandschaft 2005.","https://www.alexandria.unisg.ch/213701/","Szenario Bildungslandschaft 2005","Back, Andrea","22 April 1999","null"
"1647210237-1936","https://www.alexandria.unisg.ch/view/pub_alex_user_id/624.html?","Employee Acceptance and Use of Unified Communications and Collaboration in a Cross-Cultural Environment.","https://www.alexandria.unisg.ch/234560/","Employee Acceptance and Use of Unified Communications and Collaboration in a Cross-Cultural Environment","Silic, Mario; Back, Andrea & Sammer, Thomas","2014","International Journal of e-Collaboration"
"1647210154-1895","https://www.alexandria.unisg.ch/view/pub_alex_user_id/624.html?","Editoral.","https://www.alexandria.unisg.ch/196810/","Editoral","Back, Andrea","1 Januar 1998","Informatik/Informatique"
"1647209484-1561","https://www.alexandria.unisg.ch/view/pub_alex_user_id/624.html?","Knowledge Networking: Von der Vision zum Business Case.","https://www.alexandria.unisg.ch/213548/","Knowledge Networking: Von der Vision zum Business Case","Back, Andrea","1 Januar 2000","null"
"1647209474-1556","https://www.alexandria.unisg.ch/view/pub_alex_user_id/624.html?","Management Support Systeme im Informationszeitalter.","https://www.alexandria.unisg.ch/214123/","Management Support Systeme im Informationszeitalter","Back, Andrea","17 März 1999","null"
"1647210243-1939","https://www.alexandria.unisg.ch/view/pub_alex_user_id/624.html?","Shadow IT - A view from behind the curtain.","https://www.alexandria.unisg.ch/232521/","Shadow IT - A view from behind the curtain","Silic, Mario & Back, Andrea","1 September 2014","Computers & Security"
"1647209494-1566","https://www.alexandria.unisg.ch/view/pub_alex_user_id/624.html?","Knowledge Networks und Knowledge Management Technologien.","https://www.alexandria.unisg.ch/213377/","Knowledge Networks und Knowledge Management Technologien","Back, Andrea","27 Juni 2000","null"
"1647210261-1948","https://www.alexandria.unisg.ch/view/pub_alex_user_id/624.html?","Gestaltungsbereiche der Digitalen Transformation von Unternehmen: Entwicklung eines Reifegradmodells.","https://www.alexandria.unisg.ch/248610/","Gestaltungsbereiche der Digitalen Transformation von Unternehmen: Entwicklung eines Reifegradmodells","Berghaus, Sabine & Back, Andrea","Juni 2016","Die Unternehmung"
"1647210152-1894","https://www.alexandria.unisg.ch/view/pub_alex_user_id/624.html?","Kanzleiinformationssystem: Groupware-basiertes Wissensmanagement in Wirtschaftsprüfungs- und Steuerberatungskanzleien.","https://www.alexandria.unisg.ch/196851/","Kanzleiinformationssystem: Groupware-basiertes Wissensmanagement in Wirtschaftsprüfungs- und Steuerberatungskanzleien","Back, Andrea & Seufert, Andreas","1 Januar 1998","Datenverarbeitung-Steuer-Wirtschaft-Recht"
"1647209638-1638","https://www.alexandria.unisg.ch/view/pub_alex_user_id/624.html?","Produktivität von Wissensarbeit 2.0: Traumhaft oder traumatisch.","https://www.alexandria.unisg.ch/67613/","Produktivität von Wissensarbeit 2.0: Traumhaft oder traumatisch","Back, Andrea","3 Februar 2009","null"
"1647209822-1729","https://www.alexandria.unisg.ch/view/pub_alex_user_id/624.html?","Informationsversorgung des Staates in der Informationsgesellschaft.","https://www.alexandria.unisg.ch/213797/","Informationsversorgung des Staates in der Informationsgesellschaft","Bendel, Oliver & Back, Andrea","1 April 2003","null"
"1647209498-1568","https://www.alexandria.unisg.ch/view/pub_alex_user_id/624.html?","e-Learning-Projekte: Neue Möglichkeiten durch vernetztes Lernen. Konzepte - Geschäftsmodelle - Erfahrungen.","https://www.alexandria.unisg.ch/66839/","e-Learning-Projekte: Neue Möglichkeiten durch vernetztes Lernen. Konzepte - Geschäftsmodelle - Erfahrungen","Back, Andrea","28 September 2000","null"
"1647209978-1807","https://www.alexandria.unisg.ch/view/pub_alex_user_id/624.html?","Putting knowledge networks into action : a methodology for developing and maintaining Knowledge Networks.","https://www.alexandria.unisg.ch/254/","Putting knowledge networks into action : a methodology for developing and maintaining Knowledge Networks","null","2005","null"
"1647210273-1954","https://www.alexandria.unisg.ch/view/pub_alex_user_id/624.html?","Management von digitalen Innovationen: Hat das Innovationstrichtermodell ausgedient?","https://www.alexandria.unisg.ch/254098/","Management von digitalen Innovationen: Hat das Innovationstrichtermodell ausgedient?","Back, Andrea; Thoma, Sereina & Guggisberg, Vanessa","19 April 2018","Wirtschaftsinformatik & Management : WuM"
"1647210090-1863","https://www.alexandria.unisg.ch/view/pub_alex_user_id/624.html?","Effects of Color Appeal, Perceived Risk and Culture on User’s Decision in Presence of Warning Banner Message.","https://www.alexandria.unisg.ch/250229/","Effects of Color Appeal, Perceived Risk and Culture on User’s Decision in Presence of Warning Banner Message","Silic, Mario; Cyr, Dianne; Back, Andrea & Holzer, Adrian","7 Januar 2017","null"
"1647209506-1572","https://www.alexandria.unisg.ch/view/pub_alex_user_id/624.html?","Wissensnetzwerke: Ihr Beitrag zum persönlichen und Unternehmenswachstum.","https://www.alexandria.unisg.ch/66903/","Wissensnetzwerke: Ihr Beitrag zum persönlichen und Unternehmenswachstum","Back, Andrea","1 März 2001","null"
"1647210072-1854","https://www.alexandria.unisg.ch/view/pub_alex_user_id/624.html?","Requirements Elicitation and Utilization Scenarios for In-Car Use of Wearable Devices.","https://www.alexandria.unisg.ch/238966/","Requirements Elicitation and Utilization Scenarios for In-Car Use of Wearable Devices","Berghaus, Sabine & Back, Andrea","6 Januar 2015","null"
"1647209956-1796","https://www.alexandria.unisg.ch/view/pub_alex_user_id/624.html?","Inter-, trans- und multidisziplinär – Eine essayistische Annäherung mit Blick auf die Wirtschaftsinformatik.","https://www.alexandria.unisg.ch/231831/","Inter-, trans- und multidisziplinär – Eine essayistische Annäherung mit Blick auf die Wirtschaftsinformatik","Back, Andrea","2014","null"
"1647209761-1699","https://www.alexandria.unisg.ch/view/pub_alex_user_id/624.html?","A Vision for Knowledge Networking.","https://www.alexandria.unisg.ch/197043/","A Vision for Knowledge Networking","Seufert, Andreas; Back, Andrea & von Krogh, G.","1 Januar 1999","null"
"1647210239-1937","https://www.alexandria.unisg.ch/view/pub_alex_user_id/624.html?","Editorial: Erste Ausgabe von iTeL.","https://www.alexandria.unisg.ch/238594/","Editorial: Erste Ausgabe von iTeL","Back, Andrea; Reinmann, Gabi & Baumgartner, Peter","2014","Interdisziplinäre Zeitschrift für Technologie und Lernen (iTeL)"
"1647209699-1668","https://www.alexandria.unisg.ch/view/pub_alex_user_id/624.html?","Social Media in Universities.","https://www.alexandria.unisg.ch/146667/","Social Media in Universities","Back, Andrea","14 Juni 2011","null"
"1647209538-1588","https://www.alexandria.unisg.ch/view/pub_alex_user_id/624.html?","Wissensmanagement und -Tools.","https://www.alexandria.unisg.ch/196897/","Wissensmanagement und -Tools","Back, Andrea","1 Oktober 2002","null"
"1647210209-1922","https://www.alexandria.unisg.ch/view/pub_alex_user_id/624.html?","Disruptiv innovieren in E-Learning und Kommunikation.","https://www.alexandria.unisg.ch/67619/","Disruptiv innovieren in E-Learning und Kommunikation","Back, Andrea","1 April 2009","Netzwoche"
"1647209666-1652","https://www.alexandria.unisg.ch/view/pub_alex_user_id/624.html?","Mit Medienkompetenz zum Studierendenerlebnis.","https://www.alexandria.unisg.ch/213933/","Mit Medienkompetenz zum Studierendenerlebnis","Back, Andrea","26 November 2009","null"
"1647209882-1759","https://www.alexandria.unisg.ch/view/pub_alex_user_id/624.html?","Lern- und Wissensportale in Corporate Universities.","https://www.alexandria.unisg.ch/214312/","Lern- und Wissensportale in Corporate Universities","Back, Andrea & Bendel, Oliver","2002","null"
"1647210076-1856","https://www.alexandria.unisg.ch/view/pub_alex_user_id/624.html?","Identification and Importance of the Technological Risks of Open Source Software in the Enterprise Adoption Context.","https://www.alexandria.unisg.ch/241392/","Identification and Importance of the Technological Risks of Open Source Software in the Enterprise Adoption Context","Silic, Mario & Back, Andrea","5 März 2015","null"
"1647210197-1916","https://www.alexandria.unisg.ch/view/pub_alex_user_id/624.html?","The CC Model as Organizational Design Striving to Combine Relevance and Rigor.","https://www.alexandria.unisg.ch/213609/","The CC Model as Organizational Design Striving to Combine Relevance and Rigor","Back, Andrea; Vonkrogh, Georg & Enkel, Ellen","1 Februar 2007","Systemic Practice and Action Research"
"1647210168-1901","https://www.alexandria.unisg.ch/view/pub_alex_user_id/624.html?","Wissensmanagement - eine Bestandsaufnahme.","https://www.alexandria.unisg.ch/66718/","Wissensmanagement - eine Bestandsaufnahme","Back, Andrea; Seufert, Andreas & von Krogh, G.","1 April 2000","SAP Info"
"1647209733-1685","https://www.alexandria.unisg.ch/view/pub_alex_user_id/624.html?","Die Welt wird digital.","https://www.alexandria.unisg.ch/248986/","Die Welt wird digital","Back, Andrea","July 2016","DATEV magazin"
"1647209735-1686","https://www.alexandria.unisg.ch/view/pub_alex_user_id/624.html?","„Die Kinder üben eine Denkhaltung“.","https://www.alexandria.unisg.ch/260035/","„Die Kinder üben eine Denkhaltung“","Back, Andrea & Grüttner, Arne","Januar 2020","Personalwirtschaft - Das Magazin für den Job HR: Alter! So fördern und nutzen Sie die Talente erfahrener Mitarbeiter"
"1647210016-1826","https://www.alexandria.unisg.ch/view/pub_alex_user_id/624.html?","Web-Analyse-Dienste als Instrument des Blog-Monitoring.","https://www.alexandria.unisg.ch/68009/","Web-Analyse-Dienste als Instrument des Blog-Monitoring","Walter, Thomas & Back, Andrea","23 Februar 2010","null"
"1647209771-1704","https://www.alexandria.unisg.ch/view/pub_alex_user_id/624.html?","Development Aspects and Supportive Factors in Knowledge Networks.","https://www.alexandria.unisg.ch/298/","Development Aspects and Supportive Factors in Knowledge Networks","Köhne, M.; Enkel, Ellen; Seufert, Andreas; Back, Andrea & Vonkrogh, Georg","2000","null"
"1647209620-1629","https://www.alexandria.unisg.ch/view/pub_alex_user_id/624.html?","Lerntagebuch als Weblog innovativ umgesetzt.","https://www.alexandria.unisg.ch/213680/","Lerntagebuch als Weblog innovativ umgesetzt","Back, Andrea","8 Februar 2007","null"
"1647210104-1870","https://www.alexandria.unisg.ch/view/pub_alex_user_id/624.html?","From Suppliers to Complementors: Motivational Factors for Joining Industrial Internet of Things Platform Ecosystems.","https://www.alexandria.unisg.ch/261271/","From Suppliers to Complementors: Motivational Factors for Joining Industrial Internet of Things Platform Ecosystems","Marheine, Christian; Pauli, Tobias; Marx, Emanuel; Back, Andrea & Matzner, Martin","Januar 2021","null"
"1647209940-1788","https://www.alexandria.unisg.ch/view/pub_alex_user_id/624.html?","Social Software Use-Cases in verschiedenen Geschäftsfunktionen bei Swiss Re.","https://www.alexandria.unisg.ch/216604/","Social Software Use-Cases in verschiedenen Geschäftsfunktionen bei Swiss Re","Back, Andrea; Isenschmid, Christoph & Jastrowski, Wolfgang","2012","null"
"1647209709-1673","https://www.alexandria.unisg.ch/view/pub_alex_user_id/624.html?","Hürden gibt es nur im Kopf - Schweizer Unternehmen mit Vorsprung auf dem Weg zur Enterprise 2.0.","https://www.alexandria.unisg.ch/216772/","Hürden gibt es nur im Kopf - Schweizer Unternehmen mit Vorsprung auf dem Weg zur Enterprise 2.0","Back, Andrea","5 März 2012","null"
"1647209547-1592","https://www.alexandria.unisg.ch/view/pub_alex_user_id/624.html?","E-Learning im Unternehmen: Vom Kursprojekt zum Reengineering der Bildungsprozesse.","https://www.alexandria.unisg.ch/66843/","E-Learning im Unternehmen: Vom Kursprojekt zum Reengineering der Bildungsprozesse","Back, Andrea","24 Oktober 2002","null"
"1647209656-1647","https://www.alexandria.unisg.ch/view/pub_alex_user_id/624.html?","Business 2.0 - Die Triebfedern des partizipativen Web für Business-Innovation.","https://www.alexandria.unisg.ch/214088/","Business 2.0 - Die Triebfedern des partizipativen Web für Business-Innovation","Back, Andrea","18 September 2009","null"
"1647210191-1913","https://www.alexandria.unisg.ch/view/pub_alex_user_id/624.html?","Dissertationserhebung in der Wirtschaftsinformatik 2004.","https://www.alexandria.unisg.ch/65995/","Dissertationserhebung in der Wirtschaftsinformatik 2004","Heidecke, Florian; Back, Andrea & Brenner, Walter","1 Juni 2005","Wirtschaftsinformatik"
"1647210175-1905","https://www.alexandria.unisg.ch/view/pub_alex_user_id/624.html?","Informations- und Kommunikationsdienste für Wissensnetzwerke.","https://www.alexandria.unisg.ch/197065/","Informations- und Kommunikationsdienste für Wissensnetzwerke","Raimann, Joerg & Back, Andrea","1 Juni 2002","wisu das wirtschaftsstudium"
"1647209584-1611","https://www.alexandria.unisg.ch/view/pub_alex_user_id/624.html?","Paving the Way to Corporate e-Learning Adoption and Sustainability.","https://www.alexandria.unisg.ch/66878/","Paving the Way to Corporate e-Learning Adoption and Sustainability","Back, Andrea","1 July 2004","null"
"1647209858-1747","https://www.alexandria.unisg.ch/view/pub_alex_user_id/624.html?","Zum Verhältnis von informationstechnologischer und gesellschaftlicher Entwicklung: Bildung für Informationstechnik - Informationstechnik für Bildung.","https://www.alexandria.unisg.ch/196704/","Zum Verhältnis von informationstechnologischer und gesellschaftlicher Entwicklung: Bildung für Informationstechnik - Informationstechnik für Bildung","Österle, Hubert & Back, Andrea","1997","null"
"1647209601-1619","https://www.alexandria.unisg.ch/view/pub_alex_user_id/624.html?","How work is changing in the Information Age.","https://www.alexandria.unisg.ch/66912/","How work is changing in the Information Age","Back, Andrea","28 Februar 2006","null"
"1647209597-1617","https://www.alexandria.unisg.ch/view/pub_alex_user_id/624.html?","Das interne Geschäftsmodell für betriebliche Bildung - Herausforderungen und Entwicklungstendenzen.","https://www.alexandria.unisg.ch/214118/","Das interne Geschäftsmodell für betriebliche Bildung - Herausforderungen und Entwicklungstendenzen","Back, Andrea","29 Juni 2005","null"
"1647210193-1914","https://www.alexandria.unisg.ch/view/pub_alex_user_id/624.html?","Knowledge Management in Challenging Settings - A Case of Military Aircraft.","https://www.alexandria.unisg.ch/65844/","Knowledge Management in Challenging Settings - A Case of Military Aircraft","Mayrhofer, David; Heilmeier, Peter; Nirankari, Ravi & Back, Andrea","1 July 2005","J.UKM: Universal Journal of Knowledge Management"
"1647209812-1724","https://www.alexandria.unisg.ch/view/pub_alex_user_id/624.html?","How Knowledge Networks in practice look like: Findings from an international survey.","https://www.alexandria.unisg.ch/287/","How Knowledge Networks in practice look like: Findings from an international survey","Enkel, Ellen & Wicki, Yvonne","2002","null"
"1647210199-1917","https://www.alexandria.unisg.ch/view/pub_alex_user_id/624.html?","Blogs helfen beim Projekt-Management.","https://www.alexandria.unisg.ch/197036/","Blogs helfen beim Projekt-Management","Back, Andrea; Haentschel-erhart, Irene; Baumann, Philipp & Ziekursch, Tim","1 Mai 2007","Computerwoche"
"1647210255-1945","https://www.alexandria.unisg.ch/view/pub_alex_user_id/624.html?","Email: from hero to zero - the beginning of the end?","https://www.alexandria.unisg.ch/243832/","Email: from hero to zero - the beginning of the end?","Silic, Mario; Back, Andrea & Silic, Dario","1 November 2015","Journal of Information Technology Teaching Cases"
"1647209586-1612","https://www.alexandria.unisg.ch/view/pub_alex_user_id/624.html?","Beiträge des BSC-Ansatzes zur strategischen Verankerung von E-Learning im Unternehmen.","https://www.alexandria.unisg.ch/66826/","Beiträge des BSC-Ansatzes zur strategischen Verankerung von E-Learning im Unternehmen","Back, Andrea","27 September 2004","null"
"1647209806-1721","https://www.alexandria.unisg.ch/view/pub_alex_user_id/624.html?","Knowledge Network - Survey Findings (internal Paper).","https://www.alexandria.unisg.ch/213935/","Knowledge Network - Survey Findings (internal Paper)","Wicki, Yvonne; Enkel, Ellen; Seufert, Andreas; Back, Andrea & von Krogh, Georg","1 Oktober 2001","null"
"1647209486-1562","https://www.alexandria.unisg.ch/view/pub_alex_user_id/624.html?","Aufbau einer massgeschneiderten IT-Architektur für das Wissensmanagement.","https://www.alexandria.unisg.ch/213156/","Aufbau einer massgeschneiderten IT-Architektur für das Wissensmanagement","Back, Andrea","1 März 2000","null"
"1647209832-1734","https://www.alexandria.unisg.ch/view/pub_alex_user_id/624.html?","Current State Analysis and Identification of Opportunities in Roche's Sales Force Training.","https://www.alexandria.unisg.ch/214103/","Current State Analysis and Identification of Opportunities in Roche's Sales Force Training","Heidecke, Florian; Mayrhofer, David; Back, Andrea & Schiesser, Andreas","1 Februar 2005","null"
